"Because modern heritability estimation approaches depend on kinship estimates in this range, caution needs to be exerted in interpreting those heritability estimates if ancestry is not considered."
"In other words, heritability estimates obtained using kinship estimates without ancestry adjustment may be biased, depending on the degree to which genetic ancestry is related to the trait being examined."
"In addition to geography, which itself is correlated with ancestry, other social factors may have influenced mate selection such as race/ethnicity, nationality, education, socioeconomic status and religion."
"While the exact patterns we have seen in the FHS may not replicate elsewhere, it is likely that similarly complex mating patterns, including spouse correlations related to genetic ancestry, are a common feature, and need to be addressed in any population study."
"Ancestry-r elated assortative mating in Latino populat ions."
"Sebro R, Hoffmann TJ, Lange C, Rogus JJ, Risch NJ.Testing for non-rando m mating: evidence for ancestry-r elated assortative mating in the Framingh am heart study."
"Panmixia postpone d: ancestry-r elated assortative mating in contempor ary human populations."
"Discerning the ancestry of European American s in genetic association studies."
"Need AC, Kasper aviciute D, Cirulli ET, Goldstein DB.A genomewide genetic signatur e of Jewish ancestry perfectly separate s individuals with and without full Jewish ancestry in a large random sample of European American s."
"In one wellknown study, Turkheimer and colleagues [6] reported that the heritability of IQ is moderated by SES in a sample of 320 7-year-old twin pairs of mixed ancestry."
"Therefore, our heritability estimates may be specific to this UK population and may not generalize to other settings or ancestry groups."
"We leveraged the QC metrics made available by the UK Biobank and removed samples that had mismatch between genetically inferred sex and self-reported sex, samples that had high genotype missingness or extreme heterozygosity not explained by mixed ancestry or increased levels of marriage between close relatives, and one individual from each pair of the samples that were 3 rd degree or more closely related relatives."
"Following [12, 47], we composed synthetic genotypes as a mosaic of real genotypes from individuals of European ancestry, while preserving population structure (S1 Text)."
"The dataset consists of gene expression levels from primary monocytes, both in a naïve state and three different stimulus contexts, profiled in 432 genotyped individuals of European ancestry."
"RESEA RCH ARTICL E Discovery and fine-mapping of adiposity loci using high density imputation of genomewide association studies in individuals of African ancestry: African Ancestry Anthropometry Genetics Consortium Maggie C."
"We performed large scale meta-analyses and replications in up to 52,895 individuals for BMI and up to 23,095 individuals for WHR adjBMI from the African Ancestry Anthropometry Genetics Consortium (AAAGC) using 1000 Genomes phase 1 imputed GWAS to improve coverage of both common and low frequency variants in the low linkage disequilibrium African ancestry genomes."
"In the sex-combined analyses, we identified one novel locus (TCF7L2/HABP2 ) for WHR adjBMI and eight previously established loci at P < 5×10 -8 : seven for BMI, and one for WHR adjBMI in African ancestry individuals."
"In the sex-stratified analyses, we identified three novel loci for BMI (INTS10/LPL and MLC1 in men, IRX4/IRX2 in women) and four for WHR adjBMI (SSX2IP, CASC8, PDE3B and ZDHHC1/HSD 11B2 in women) in individuals of African ancestry or both African and European ancestry."
"In the trans-ethnic fine mapping of 47 BMI loci and 27 WHR adjBMI loci that were locus-wide significant (P < 0.05 adjusted for effective number of variants per locus) from the African ancestry sex-combined and sex-stratified analyses, 26 BMI loci and 17 WHR adjBMI loci contained  20 variants in the credible sets that jointly account for 99% posterior probability of driving the associations."
"CARDIA: The Coronary Artery Risk Developmen t in Young Adults (CARDIA) study is supported by the NHLBI (contracts HHSN2682 01300025C, HHSN268 201300026C, HHSN2682 01300027C, including up to 71,412 and 27,350 African ancestry individuals, respectively, our results suggest that 1000 Genomes imputation showed modest improvement in identifying GWAS loci including low frequency variants."
"Trans-ethnic meta-analyses further improved fine mapping of putative causal variants in loci shared between the African and European ancestry populations."
"We conducted large scale high coverage GWAS and replication of these traits in 52,895 and 23,095 individuals of African ancestry, respectively, followed by additional replication in European populations."
"We combined African and European ancestry GWAS and were able to narrow down 43 out of 74 African ancestry associated genetic regions to contain small number of putative causal variants."
"Our results highlight the improvement of applying high density genome coverage and combining multiple ancestries in the identification and refinement of location of genetic regions associated with adiposity traits."
"We took this opportunity to use higher density imputation to reevaluate our previous GWAS for associations with anthropometric traits in individuals of African ancestry (AA) including African Americans and Africans."
"In the sex-combined meta-analysis of BMI in AA, seven previously established European or African ancestry-derived loci in/near SEC16B, TMEM18, GNPDA2, GALNT10, KLHL32, FTO and MC4R reached genome-wide significance (P < 5×10 -8 ) (Table 1, S6 and S10A Figs)."
"Evaluation of established European loci in African ancestry populations Conditional analysis in GWAS loci."
"For all other loci, the lead variants demonstrated substantially lower significance upon conditional analysis, suggesting that the African ancestry results represented the same association signals as previously reported in GWAS performed predominantly in EA populations (S10 Table)."
"P-values for all variants including the most significant variant are based on the African ancestry discovery phase only (AA-Disco very)."
"In addition , for the most significant variant, P-values are annotated and illustra ted from the African ancestry discovery and replica tion phases (AA-Discov ery+Replic ation)."
"SNP rs24725 91 was available in the Europeans from the GIANT consortium effort and combined with the African ancestry discove ry and replication phases (AA+EA)."
"P-values for all variants including the most significant variant are based on the African ancestry discovery phase only (AA-Disco very)."
"In addition, for the most significant variant, Pvalues are annotated and illustrat ed from the African ancestry discovery and replication phases (AA-Dis covery+Rep lication)."
"Addition al novel BMI and WHR adjBMI loci at P < 5×10 -8 in sex-str atified analyses of African ancestry discovery and replication samples ."
"We constructed 99% credible sets containing variants that jointly account for 99% posterior probability of driving the association in a locus using the corresponding sex-combined or sex-stratified meta-analysis results from AA, EA and combined ancestry (S13 Table)."
"Among these 43 tractable loci, the lead variants in the combined ancestry analyses had posterior probability  0.95 in six BMI loci (SEC16B, TLR4, STXBP6, NLRC3, FTO and MC4R) and seven WHR adjBMI loci (DCST2, PPARG, ADAMTS9, SNX10, KLF13, CMIP and PEMT) (S13 Table)."
"By employing a recently developed method [23] to impute European GWAS summary statistics to the denser 1000 Genomes reference panel, followed by meta-analyses of both African and European ancestry individuals, we also identified three additional novel loci (SPRYD7/DLEU2, CASC8 and ZDHHC1/ HSD11B2) for WHR adjBMI ."
"Our large-scale GWAS meta-analyses in African ancestry individuals imputed to the 1000 Genomes reference panel, complemented by imputation of European GWAS using summary statistics and additional sex-stratified analyses, boosts the study power and improves resolution, leading to the identification of nine novel loci and fine mapping 37 loci with tractable credible sets."
"Given the substantially larger sample size in European than in African ancestry samples, the trans-ethnic fine mapping results are largely driven by variants showing strong associations in Europeans."
"Performance of 1000 Genomes imputation in African ancestry We evaluated the performance of 1000 Genomes imputation using the largest study, the Women’s Health Initiative (WHI) (N = 8,054)."
"We used 8,054 unrelated individuals of African ancestry from the WHI cohort with ~15.7M variants available as the reference sample for LD estimation."
"Quantile-quantile plot of 1000 genomes phase 1 imputed discovery results and their associations to adult BMI in men and women of African ancestry using all variants and only variants outside of known GWAS loci."
"Quantile-quantile plot of 1000 genomes phase 1 imputed discovery results and their associations to adult BMI in women only and men only of African ancestry using all variants and only variants outside of known GWAS loci."
"Quantile-quantile plot of 1000 genomes phase 1 imputed discovery results and their associations to adult waist-to-hip ratio adjusted for BMI (WHR adjBMI ) in men and women of African ancestry using all variants and only variants outside of known GWAS loci."
"Quantile-quantile plot of 1000 genomes phase 1 imputed discovery results and their associations to adult waist-to-hip ratio adjusted for BMI (WHR adjBMI ) in women only and men only of African ancestry using all variants and only variants outside of known GWAS loci."
"Manhattan plot of 1000 genomes phase 1 imputed discovery results and their associations to adult BMI in men and women of African ancestry."
"Manhattan plot of 1000 genomes phase 1 imputed discovery results and their associations to waist-to-hip ratio adjusted for BMI (WHR adjBMI ) in men and women of African ancestry."
"Miami plot of 1000 genomes phase 1 imputed discovery results and their associations to adult BMI in women only (top) and men only (bottom) of African ancestry."
"Miami plot of 1000 genomes phase 1 imputed discovery results and their associations to adult waist-to-hip ratio adjusted for BMI (WHR adjBMI ) in women only (top) and men only (bottom) of African ancestry."
"P-values for all variants including the most significant variant are based on the African ancestry discovery phase only (AA-Discovery)."
"In addition, for the most significant variant, P-values are annotated and illustrated from the African ancestry discovery and replication phases (AA-Discovery+Replication)."
"Correlation of effect sizes for (A) BMI and (B) WHR adjBMI , and effect allele frequencies for (C) BMI and (D) WHR adjBMI in European and African ancestry studies in SNP transferability analyses."
"Associations of lead variants from novel and previously identified BMI and WHR adjBMI loci in combined and sex-stratified analyses of African ancestry discovery and replication samples."
"Association of African Ancestry sex-combined genome-wide significant variants in children of African ancestry."
"Conditional analysis of African ancestry primary and secondary lead SNPs with European lead SNPs in previously identified BMI and WHR adjBMI loci."
"SNP transferability of BMI and WHR adjBMI lead SNPs from European sex combined and sex stratified GWAS in African ancestry individuals."
"Locus transferability and conditional analyses of European BMI and WHR adjBMI loci in African ancestry individuals."
"Fine mapping of novel loci and previously identified loci with locus-wide significance in African ancestry individuals using 1000 Genomes imputed results from African, European and combined ancestries."
"Functional characterization of variants in tractable credible sets in meta-analysis of African and European ancestry GWAS."
"To identify adiposity loci whose effects are modified by PA, we performed genomewide interaction meta-analyses of BMI and BMI-adjusted waist circumference and waist-hip ratio from up to 200,452 adults of European (n = 180,423) or other ancestry (n = 20,029)."
"In addition, we carried out meta-analyses in European-ancestry studies only and in European and other-ancestry studies combined."
"We identified a genome-wide significant interaction between rs986732 in cadherin 12 (CDH12) and PA on BMI in European-ancestry studies (beta INT = -0.076 SD/allele, P INT = 3.1x10 -8 , n = 134,767) (S7 Table)."
"We identified a significant SNP×PA interaction of the FTO rs9941349 SNP on BMI in the meta-analysis of European-ancestry individuals; the BMI-increasing effect was 33% smaller in active individuals (beta ACTIVE = 0.072 SD/allele) than in inactive individuals (beta INACTIVE = 0.106 SD/allele, P INT = 4x10 -5 )."
"(Continued ) Trait Marker Nearest Gene Chr Pos (hg19) Trait increas ing/ decreasi ng allele Trait increas ing allele’s frequen cy Analysis N adjPA Beta adjPA SE adjPA P adjPA P int P joint WHR adjBMI rs69769 30 BAZ1B 7 72,885,810 G/A 0.81 Overall 145913 0.0294 0.0051 1.03E08 5.28E01 1.87E08 Women 83184 0.0326 0.0066 7.70E07 7.00E01 2.02E06 Men 62149 0.0254 0.0075 7.69E04 5.93E01 3.10E03 WHR adjBMI rs10786 152 PLCE1 10 95,893,514 A/G 0.52 Overall 147123 0.0224 0.004 1.79E08 8.76E02 1.44E08 Women 83884 0.0192 0.0051 1.56E04 5.81E02 1.41E04 Men 62722 0.0255 0.0058 1.32E05 6.38E01 5.89E05 WHR adjBMI rs8895 12 CTRB2 16 75,242,012 C/G 0.88 Overall 117417 0.031 0.0074 2.70E05 4.26E01 1.13E04 Women 70315 0.0506 0.0091 2.87E08 9.96E02 1.09E07 Men 46440 -0.0022 0.0114 8.50E01 5.06E01 7.80E01 Novel loci achieving genom e-wide signi<U+FB01>ca nce in all-ancestr y meta-ana lyses BMI rs7546 35 CCK 3 42,305,131 G/C 0.87 Overall 151282 0.0356 0.0062 1.07E08 1.21E01 3.28E07 Women 91241 0.026 0.0079 9.66E04 1.25E01 8.69E04 Men 62741 0.0486 0.0093 1.61E07 2.98E01 3.68E06 Chr: chromosome ; Pos(hg19): position based on human assembl y 19; N adjPA , Beta adjPA , SE adjPA , or P adjPA : sample size, effect size, standard error, or P value, respectivel y, in the physica l activity adjusted SNP main effect model; PA: physical activity; WC adjBMI : BMI-adj usted waist circumf erence; WHR adjBMI : BMI-adjust ed waist-hip ratio; P int : P value for SNP-PA interaction ; P joint : P value for the joint test of SNP main effect and SNP-PA interaction ."
"A GWAS of BMI in 62,246 individuals of East Asian ancestry showed a suggestive association (P = 2x10 -7 ) for the rs437746 9 SNP in high LD with our lead SNP (r 2 = 0.7) [55]."
"In the analyses for SNPs identified in our meta-analyses of all ancestries combined, the reference sample comprised 93% of European-ancestry individuals and 6% of African ancestry participants from ARIC, as well as 1% of CHB and JPT samples from the HapMap2 panel, to approximate the ancestry mixture in our all ancestry meta-analyses."
"Quantile-Quantile and Manhattan plots for the genome-wide meta-analysis results of the SNP main effect adjusting for physical activity (SNPadjPA), interaction between SNP and physical activity, and the joint effect of SNP main effect and SNP×PA interaction (Joint2df) in men and women of European-ancestry combined."
"All SNPs that met significance for BMI in the all ancestry analyses for at least one of the approaches tested: interaction, adjusted for physical activity, or jointly accounting for the main and interaction effects."
"All SNPs that met significance for waist circumference adjusted for BMI in the all ancestry analyses for at least one of the approaches tested: interaction, adjusted for physical activity, or jointly accounting for the main and interaction effects."
"All SNPs that met significance for waist-to-hip ratio adjusted for BMI in the all ancestry analyses for at least one of the approaches tested: interaction, adjusted for physical activity, or jointly accounting for the main and interaction effects."
"Gene x physical activity interactions in obesity: combined analysis of 111,421 individuals of European ancestry ."
"We detected evidence of population structure between the ancestral Han and Tibetan subpopulations as early as 44 to 58 thousand years ago, but with high rates of gene flow until approximately 9 thousand years ago."
"Similarly, ADMIXTURE analysis[19] (Supplementary Methods) on the same six populations shows that when the number of ancestral populations (K) was set to less than 6, Tibetans and Han Chinese were genetically similar."
"The estimated proportion of Tibetan genetic ancestry was greater than 99% for 19 out of the 27 Tibetan individuals."
"For the remaining Tibetan individuals, the average estimated proportion of Tibetan genetic ancestry was 83.1%."
"For the demographic history analysis, we excluded Tibetan individuals with less than 99% Tibetan genetic ancestry."
"(A) The effective population size as the function of time in the past for Tibetans (red) and Han (blue), estimat ed using 4 Han and 4 Tibetan genomes with greater than 99% correspo nding genetic ancestries."
"This indicates that the haplotype homozygosity around the derived allele is much higher than around the ancestral allele, a scenario consistent with strong positive selection."
"Mapping regions with high Denisovan ancestry in the Tibetan genome To evaluate whether any genomic regions with Denisovan introgression other than EPAS1 may contribute to Tibetan high-altitude adaptation, we first calculated D-statistics[46] to evaluate the overall level of Denisovan admixture in the Tibetan genome."
"As shown in S6 Fig, MSMC was indeed unable to detect the ancestral population split at 54 kya."
"Our analyses detected evidence of population structure between the ancestral Han and Tibetan subpopulations beginning between 44 and 58 kya, although admixture rates between the two subpopulations remained high until around 9 kya."
"Each column represents one individual and different colors represent different ancestral population; each panel represents one K value."
"These studies have not included individuals with an Amerindian ancestral background, such as Hispanics/Latinos, nor evaluated the full spectrum of genomic variation beyond single nucleotide variants."
"Using a custom genotyping array enriched for Amerindian ancestral content and 1000 Genomes imputation, we performed GWAS in 12,502 participants of Hispanic Community Health Study and Study of Latinos (HCHS/SOL) for hematocrit, hemoglobin, RBC count, RBC distribution width (RDW), and RBC indices."
"In addition to the known 3.8kb alpha-globin copy number variant, we identified an Amerindian ancestral association in an alpha-globin regulatory region on chromosome 16p13.3 for mean corpuscular volume and mean corpuscular hemoglobin."
"Together, these results reinforce the importance of genetic study of diverse ancestral populations, in particular Hispanics/Latinos."
"Prior genetic studies have identified physical regions of the genome associated with RBC traits in populations with European, African, and Asian ancestry."
"These studies have not included individuals with ancestry from the American continents (Amerindian ancestry), such as Hispanics/Latinos."
"These results contribute to understanding the physiology of red blood cells and reinforce the importance of genetic study of diverse ancestry populations, in particular Hispanics/Latinos."
"RBC traits differ by self-reported ancestry, and both genetic (e.g., inherited hemoglobin variants) and acquired (e.g., iron deficiency, kidney disease) factors contribute to these ethnic differences[1, 2]."
"Hispanics/Latinos are ethnically heterogeneous, with admixture of European, West African, and Amerindian ancestral populations."
"As with most complex traits, GWAS for discovery or generalization of RBC trait loci has yet to be performed in Hispanics/Latinos or other populations with Amerindian ancestry."
"Genomic regions and variants previously implicated in Mendelian RBC disorders include the African ancestral alleles for sickle cell trait/anemia or hemoglobin S (HBB rs334); hemoglobin C (HBB rs33930165); the common African form of G6PD Adeficiency (rs1050828); the 3.8kb alpha-globin gene deletion responsible for alpha-thalassemia trait (esv2676630); and a proxy SNP (rs2032451) for the European hereditary hemochromatosis (HFE) p.H63D allele."
"To formally assess whether variants previously associated with RBC traits in populations of European, Asian, and African ancestry generalized to HCHS/SOL Hispanics/Latinos, we used a directional FDR approach."
"The HBB rs334, HBB rs33930165, esv2676630 alpha-globin 3.8kb gene deletion, and G6PD rs1050828 lead variants are derived from an African ancestral background, while the HFE hemochromatosis variant rs2032451 (proxy of rs1799945 p.H63D) is common among Europeans and Amerindian populations and much less common among Asians and West Africans."
"In addition, we note that the two newly reported independent association signals at the chromosome 16 alpha-globin locus—rs148323035/rs14 5546625 (Table 3) and the 3.8kb duplication—appear to be more common among populations of Amerindian ancestry[20, 21]."
"To assess whether any additional genomic regions might contain ancestrally differentiated SNPs associated with RBC traits, we performed a genome-wide admixture-mapping scan in HCHS/SOL for discovery analysis in each RBC trait."
"We also showed that common African ancestral hemoglobin variants (beta-globin Hb S and Hb C missense variants rs334 and rs33930165, and alpha-globin 3.8kb thalassemia structural variant) and the African G6PD Avariant are associated with variation in RBC traits among the U.S."
"We additionally provide a more detailed characterization of allelic heterogeneity at the alphaand beta-globin loci, including a newly identified Amerindian ancestral variant that overlaps a known regulatory region of the alpha-globin gene cluster."
"The HCHS/SOL cohort represents a diverse subsample of Hispanics/Latinos across the U.S., with varying admixture proportions of three continental ancestry groups: Amerindians, Africans, and Europeans."
"Here, we establish that these same common African ancestral hemoglobin and G6PD gene variants are associated with quantitative RBC phenotypes among U.S."
"These results demonstrate that the same loci are likely involved in RBC trait biology across global populations, whether the functional variants are shared with or differ between ancestral groups."
"This includes an Amerindian ancestral variant at the alpha-globin gene cluster that overlaps a known alpha-globin regulatory region."
"This particular variant is monomorphic among European, Asian, and African ancestral populations."
"In order to capture more Amerindian variation, the Omni2.5M array was modified by the addition of custom content comprised of ~150K SNPs selected from the CLM, MXL, and PUR 1000 Genomes Phase I samples for higher informativeness to identify Amerindian continental ancestry and for higher frequency in Amerindian genomic segments."
"Admixture mapping analysis Local ancestry estimates were previously inferred in the HCHS/SOL[59]."
"A genome-wide admixture mapping scan was performed using a linear mixed model with covariates and random effects described above, jointly testing the three ancestries (European, African, Amerindian) at each available locus."
"There are currently no well-developed, validated methods available for local ancestry estimation on the X chromosome."
"Most of these SNPs were reported in studies of adults of European ancestry, but we also generalized associations from Africanand Japanese-ancestry populations."
"Generalization of variants previously associated with seven red blood cell traits in European-, Asian-, and African-ancestry populations to HCHS/SOL Hispanics/Latinos."
"Genome-wide Associat ion Study of Platelet Count Identifies Ancestry -Specific Loci in Hispanic /Latino American s."
"Local Ancestry Inference in a Large US-Base d Hispanic/ Latino Study: Hispanic Communit y Health Study/Study of Latinos (HCHS/S OL)."
"Participating studies will usually have been independently designed and implemented in unique settings that are potential sources of phenotype, ancestry or other variability that could introduce between-study heterogeneity into a meta-analysis."
"Application to a GWAS meta-analysis of coronary disease with 48 contributing studies uncovered substantial systematic between-study heterogeneity, which could be partly explained by age-of-disease onset, family-history of disease and ancestry."
"Participating studies that were independently commissioned are likely to include specific and varied design features, for instance the precise specification of the phenotype or ascertainment criterion, environmental risk factor profiles or genetic ancestry."
"Participants had been recruited from several ancestry groups (African American, Hispanic American, East Asian, South Asian, Middle Eastern and European)."
"We examined three potential sources of systematic heterogeneity that might have influenced the CARDIoGRAMplusC4D meta-analysis 1) ancestry, 2) family-history and 3) age-of-onset of disease (S5 Table)."
"A meta-regression of the M statistics with ancestry coded into 6 groups (African and Hispanic American, South and East Asian, Middle Eastern and European) suggested that some of the variability in average effect size could be explained by ancestry (F 5, 42 = 2.52, P = 0.044) (Fig 4A)."
