"We used the ChromoPainter package implemented within the standard pipeline of FineSTRUCTURE version 2 (fs-2.1.1) [26], to estimate the co-ancestry matrix of the WGS and barcode data."
"To construct clinic-averaged co-ancestry estimates, we averaged the received and donated counts within and across clinics."
"To explore spatial structure and concordance with IBD-based analyses, clinic-averaged co-ancestry estimates were regressed onto inter-clinic distance, and compared with corresponding estimates based on IBD (S3 Text)."
"Additional details and plots of co-ancestry estimates."
"Functional analysis of the variants identified in this study is the next step to determine which variants and genes are affected, and replication of these lipid and lipoprotein subclass associations in women and in other ancestry groups will be useful to better understand the genetic architecture of lipid and lipoprotein metabolism."
"The case-control cohort on ADSP consists of 10,909 individuals, 5,844 cases, 4,767 cognitive normal participants and 298 reported as OT, mostly of European-Ameri - can ancestry (98%)."
"The familial cohort of the ADSP consists of 582 individuals from 111 multiplex AD families from European-American, Caribbean Hispanic, and Dutch ancestry (Details about the samples are available at NIAGADS)."
"We downloaded raw data (.sra format) from dbGAP for 143 IDs (113 cases and 23 controls) from 37 multiplex families of EuropeanAmerican ancestry that were incorporated with the KANL familial dataset."
"The figure shows the founder that is ancestral to Q and all descendan ts of that founder , highlighting in orange those with haplotype (0, 0, -1)."
"Since these individuals share paternal-line ancestry with Q, some of them could be similar to Q in ethnic identity, language, religion, physical appearance and place of residence.” If there is database frequency information, the court could be further advised, for example: “The Y profile of Q was not observed in a database of 1,000 profiles."
"Coancestry, kinship and sampling adjustments For autosomal DNA profiles a coancestry adjustment is generally recommended to allow for remote shared ancestry between Q and X, the hypothetical alternative source of the DNA."
"The overall goal of this study is to elucidate differences in molecular alterations in MM as a function of self-reported race and genetic ancestry."
"Somatic mutational analyses based upon self-reported race corrected for ancestry revealed significant differences in mutation frequency between groups."
"Alternatively, genetic ancestry is characterized by population genetic informative markers derived from allele frequencies of single nucleotide variances across biogeographical distributions [15] and is another way to characterize populations and individuals."
"The strength of genetic ancestry is that it offers information on ancestral genetic contributions based upon percent admixture within a given individual."
"While genetic ancestry provides molecular information with direct biological implications within the context of a disease [16, 17], we cannot disregard the importance of self-reporting that is influenced by socio-environmental behaviors that also play a critical role in disease risk."
"However, the availability of self-reported race and WES data from CoMMpass IA9 provided the unprecedented opportunity to search for novel and statistically significant somatic alterations relative to ancestrally-defined population differences in MM cases."
"Characterization of CoMMpass IA9 cases by genetic ancestry To delineate genetic ancestry, we used a population stratification principal component analysis (PCA) to cluster MM patients by extracting 4,761 Ancestry Informative Markers (AIMs) SNP genotypes derived from germline WES CoMMpass IA9 data (Fig 1A)."
"This allowed us to assess the distribution of genetic ancestry for CoMMpass cases [18]."
"We also utilized STRUCTURE [19] to determine individual percent ancestry for each CoMMpass case (Fig 1B, S1 Table)."
"Analysis of individual ancestry data revealed that two self-reported CA had greater than 55% African ancestry and one self-reported African American had 99.9% European ancestry (Fig 1A, red circles, S1 Table)."
"Populatio n stratification by principal component analysis and STRUCTU RE plot defining proposit ions of calculat ed genetic ancestry."
"(B) STRUCTU RE plot (K = 2; 50,000 Burnin period and 100,000 MCMC repeats) used to interfe re genetic clusters and percent admixture : European Ancestry (red), African Ancestry (green)."
"Percent ancestry track is indicatin g the distribution of genetic ancestry among each sample."
"Given the significantly higher TP53 mutation rate among CA MM cases prompted us to assess the distribution of TP53 mutation status as a function of European ancestry."
"Comparison of somatic copy number changes between AA and CA MM cases To uncover potential racial or ancestry differences in copy number events across CoMMpass IA9 WES data, we utilized GISTIC 2.0 analysis [20, 22]."
"Comparison between African and European ancestry and by self-reported race further sub-stratified by MM karyotype did not reveal a significant difference (p = 0.662) of the UAMC high-risk signature consistent with our previous report from an independent data set (Table 2) [14]."
"Further analysis of Ki67 proliferation index showed no significant difference (p = 0.560) of Ki67 profile among patients stratified by race or ancestry (S5 Fig) false discovery rate (q<0.1) with significant genes labeled as following: exclusiv e to African American (<U+0394>) and Caucas ian (r), or if the same gene is identifi ed by both analysis “Both” (<U+03C8>)."
"Alteration of TP-53 across ancestry."
"Analysis of TP53 state across the percent European ancestry."
"Through the analysis of CoMMpass data, we were able to analyze the largest multi-ethnic MM cohort at diagnosis to date, in an attempt to elucidate in-depth molecular differences in tumors derived from AA and CA cases to further understand the biological determinants of MM as a function of tumors derived from an ancestrally defined dataset."
"Differences in mutation frequencies in genes such as RYR1, RPL10, PTCHD3, BCL7A, SPEF2, MYH13, ABI3BP, BRWD3, GRM7, AUTS2, PARP4, PLD1, ANKRD26, DDX17 and STXBP4 that were more common in AA MM cases could possibly reflect differences of myelomagenesis by race and/or ancestry."
"Although the functional role of FAM46C in myelomagenesis is still yet to be determined, there seems to be a potential enrichment of its role in MM biology among tumors derived from patients of African ancestry."
"Ultimately, our study represents among the most comprehensive (WES and RNAseq) genomics studies of a tumor type in patients of African descent, and sheds light on potential ancestry-related differences in biological mechanisms of myelomagenesis."
"This resulted in final 721 samples that passed the quality threshold and were used to determine genetic ancestry across the samples."
"The reference populations used for the putative ancestral populations were derived from publically available 1000G Population Exome Phase1_v3 Genotypes [18]."
"The high-risk expression signature was calculated and reported as percent frequency across each ancestry and MM subtype."
"(A) Comparison of nonsilent mutation frequency between ancestry and self-reporting using Wilcoxon, Mann-Whitney, and Unpaired t-test to determine statistical significance."
"(B) Mutation signature associated with African and European ancestry."
"Genomic data utilized, gender, reported race, and inferred genetic ancestry utilized in this study."
"Genetic ancestry in lungfunction predictions ."
"Ancestry and pharmaco genomics of relapse in acute lymphobla stic leukemia."
"Ancestry informative marker sets for determin ing continental origin and admixture proportion s in commo n populations in America."
"Ancestry informati ve marker panels for African Americans based on subsets of comme rcially availabl e SNP arrays."
"Informativen ess of genetic markers for inferenc e of ancestry."
"To maximize sample size, both cases and controls included individuals with diverse ancestries including African, Caucasian, East Asian, Hispanic, Middle Eastern, and South Asian."
"This therefore confirms that lineage fate decisions had commenced upstream of the CMPs in ancestral HSPCs."
"It would therefore be worthwhile to determine whether CD31 deficiency impacts ancestral HPCs as well as their megakaryocytic progeny."
"The CMP appears to be far scarcer than previously understood and it is likely that the LSK Multipotent Progenitor fractions may dominate in terms of common myeloid ancestry, particularly as they yield greater numbers of CFU-GEMMs than immunophenotypic CMPs."
"All analyses were limited to self-reported non-Hispanic whites (mixed European descent); self-reported race was consistent with genetically-determined ancestry."
"Accordingly, when populations from the neighbouring island of Britain are included, a west-east cline of Celtic-British ancestry is revealed along with a particularly striking correlation between haplotypes and geography across both islands."
"However, runs of homozygosity are relatively long and frequent in Ireland [10] and correlate negatively with population density and diversity of grandparental origins [11], suggesting that low ancestral mobility may have preserved regional genetic legacies within Ireland, which may be detectable in modern genomes as local population structure embedded within haplotypes."
"Ireland was also excluded from admixture and ancestry analyses due to the confounding effects of the island acting as “a source and a sink for ancestry from the UK”."
"Our inclusion of Irish data with previouslypublished data from Britain presents a more complete representation of genetic ancestry in the contemporary populations of the British Isles, providing a comprehensive population genetic perspective of the peopling of these islands."
"Clustering the resulting coancestry matrix using fineSTRUCTURE identified 23 clusters, demonstrating local population structure within Ireland to a level not previously reported, with apparent geographical, sociopolitical and ancestral correlates (Fig 1)."
"However interpreted, the firm implication of the observed clustering is that despite its previously reported homogeneity, the modern Irish population exhibits genetic structure that is subtly but detectably affected by ancestral population structure conferred by geographical distance and, possibly, ancestral social structure."
"Using an unsupervised ADMIXTURE analysis [18], we observed that one of the ADMIXTURE clusters (k = 2) comprises the totality of ancestry of several Anglo-Saxon individuals and forms the largest proportion in British groups, with varying representation across Irish clusters (S8 Fig)."
"PC2 therefore captures an east to west Anglo-Celtic cline in Irish ancestry."
"The southeast England (SEE) cluster group is centred at zero on PC4, representing a group with predominantly Anglo-Saxon-like ancestry (S8 Fig)."
"It is notable that after the split of the ancestrally divergent Orkney, successive PCs describe diversity in British populations where “Anglo-saxonization” was repelled [22]."
"This suggests a contribution of historical Viking settlement to the contemporary Irish genome and contrasts with previous estimates of Viking ancestry in Ireland based on Y chromosome haplotypes, which have been very low [25]."
"A summary of the date estimates and 95% confiden ce intervals for inferred admixture events into Ireland from European and British admixing sources is shown in (A), with ancestry proporti on estimates for each historical source populati on for the two events and example coancestr y curves shown in (B)."
"If the sources come from the same ancestral group the slope of this curve will be negative (as with FRA(8) vs FRA(8)), while a positive slope indicates that sources come from differe nt admixing groups (as with FRA(8) vs NOR-SG )."
"The inclusion of Irish data with British samples from the PoBI study provides an anchor for Celtic ancestry in the British Isles, filling out the genetic landscape of the islands."
"Unlike the PoBI study, Irish data were not specifically selected for longstanding pure ancestry in each geographic region (for example, having four grandparents in a location), but instead represent a repurposed medical dataset."
"TVD can therefore be used to determine whether fineSTRUCTURE clusters detect significant differences in haplotype sharing, and hence ancestry."
".B g are thus interpreted as the “cleaned” proportions of the genome ancestral to each donor group."
"To assess uncertainty of these ancestry proportion estimates we again follow PoBI [7] and resample from the ChromoPainter chunk length output to generate N p pseudo individuals for each cluster P."
"We also used this linear regression model to determine per-individual ancestry proportion estimates from different British clusters across Ireland, treating each individual as a cluster to enable us to assess whether gene flow from northern Britain had a gradient across Ireland."
"This British admixture component was regressed against PC2 of the Irish ChromoPainter coancestry matrix to determine the role of British ancestry in the differentiation of PC2 in Ireland."
"British ancestry profile in Irish clusters."
"Bar charts displaying the GLOBETROTTER estimated British ancestry profile for Republic of Ireland clusters (Defined in S5 Fig; Only clusters with 35+ samples displayed) from British clusters inferred from 2,017 individuals using fineSTRUCTURE (Defined in S3 Fig)."
"European ancestry profile in Irish clusters."
"Bar charts displaying the GLOBETROTTER estimated European ancestry profile for republic of Ireland clusters (Defined in S5 Fig; Only samples with 35+ samples displayed) from European clusters inferred from 4,514 individuals using fineSTRUCTURE (Defined in S4 Fig)."
"Fast model-b ased estimation of ancestry in unrelated individuals ."
"Unravellin g the hidden ancestry of American admixed populations."
"We further paired these marginal statistics with a SNP correlation matrix estimated using 503 individuals of European ancestry from the 1,000 Genomes Project [55]."
"We paired the marginal z-scores from these studies with the SNP correlation matrix estimated using 503 individuals of European ancestry from the 1,000 Genomes Project [55] for inference."
"[22], they found indirect evidence of a male-biased ESR in the lineage ancestral to the split between European and Asian populations, coinciding with the Out-of-Africa expansion."
"Here, we present a hierarchical Bayesian model to estimate contemporary and ancestral ESR in multiple populations, and therefore, to identify historical changes in sex-specific demography."
"Each population has a label, i, which varies from 1 to I for the sampled populations, and from I + 1 to r for the internal nodes of the tree, where r represents the population at the root of the tree (i.e., the most ancestral population in the tree)."
"In the following, we denote a(i) as the ancestral population of population i."
"Assuming that genetic drift occurs independently in each branch of the tree (i.e., there is no migration between branches), we may characterize the gene frequency hierarchically along the tree from the most ancestral population toward the leaves."
"The reference allele frequency for any given SNP j along the branches of the tree is assumed to follow Kimura’s time-dependent diffusion approximation p K ðx ðOÞ ij j x ðOÞ aðiÞj ; t ðOÞ i Þ, conditional upon the ancestral reference allele frequency x a(i)j in the parental population and upon the branch length t ðOÞ i  t i =ð2N ðOÞ e;i Þ (see Eqs 4.9 and 4.16 in Kimura [31])."
"Since the K IM T REE model assumes that all polymorphisms are ancestral (an assumption which is not made in the simulations), we defined a large population size for the root population (made of 50,000 males and 50,000 females)."
"We evaluated the impact of recent mutations by varying the ancestral population size and therefore the occurrence of recent mutations in the tree (i.e., mutations occurring after the split of the root population, which are not accounted for in the K IM T REE model)."
"With smaller ancestral population size, a situation that results in a more likely presence of recent mutations in the tree, we found that the internal branch lengths were largely underestimated (see S9A and S9B Fig)."
"In general, however, our simulations showed that the branch-length and ESR estimates were more accurate with larger ancestral population sizes (see S9D–S9F Fig)."
"This might be due to a higher power in characterizing recent ESR as compared to ancestral ones."
"In addition, recent (non-ancestral) polymorphism seems to more strongly affect internal branches, possibly contributing to a higher uncertainty in the ESR for those branches (S9 Fig)."
"More interestingly, we found a strongly male-biased ESR (four effective females for 100 effective males) in the internal branch of the tree, which is ancestral to the ANG and HOL breeds."
"In a single population (or a branch in a population tree), the number of ancestral lineages of a sample of genes decreases over time (looking backward) due to coalescent events."
"Therefore, in the absence of newly arising mutations, the jth site will be fixed in the sampled populations, if all the ancestral lineages of the sample in the root node carry the same allelic state, i.e."
"The probabilities P ðy rj ¼ 0Þ and P ðy rj ¼ n rj Þ may be obtained by integrating over the probability distribution of the number of ancestral lineages in the root node, weighted by the probability that all the ancestral lineages are of the same allelic type (see below)."
"The number of ancestral lineages in the root node, which is a random variable, depends upon the number of coalescences that occur in the intervals between the nodes of the tree."
"For each interval (i.e., for each branch), we therefore need to compute the number of ancestral lineages, looking backward in time, given the current number of lineages and the branch length."
"Tavare ´ [69] derived the distribution of the number k of ancestral lineages P ðk j i; tÞ for one population, given the current number of lineages i, and the time interval t (in a diffusion timescale)."
"Here, ~n aðiÞj is the (random) number of lineages in the ancestral node a(i) of i."
"Also, note that the probability distribution P c ð ~n aðiÞj Þ for the number of ancestral lineages in that node is defined for k = 2, ."
"The case of more than two populations sharing the same ancestral node follows analogously."
"The full probability distribution of ancestral lineages for the node a(i) after time t a(i) is then be given by: P ð ~n aðiÞj ¼ k 0 j t aðiÞ Þ ¼ X k P ðk 0 j k; t aðiÞ ÞP c ð ~n aðiÞj ¼ kÞ ð9Þ Combining all branches, recursively, in the population tree, we get the probability distribution of the number of ancestral lineages in the root node r at site j, P ð ~n rj j t Þ."
"Then the number of ancestral lineages in the root node, P ð ~n rj ¼ k j n; t Þ, is independent of site j and is therefore equal across loci."
"The mutation rate was set to µ = 1.5 × 10 -7 with an ancestral (root) population made of 50,000 males and 50,000 females."
"We simulated a four-population tree with topology ((1,2),(3,4)) under the inference model, using a slice-sampling algorithm and assuming a Beta(1,1) distribution for the ancestral allele frequencies."
"The data were then reduced to polymorphic sites, and we ran analyses assuming a beta distribution with fixed parameters for the ancestral allele frequencies (B(1,1)); we ran analyses where the parameters of the beta distribution were inferred from the data (B(a,b)); last we ran analyses using the conditional likelihood model (CND)."
"The ancestral allele frequencies were drawn from a Beta (1,1) distribution, and 5,000 SNPs were simulated with n = 100 haploid individuals sampled in each population."
"[48] with the beta-with-spikes model is provided (BS); we further ran K IM T REE analyses assuming a beta distribution with fixed parameters for the ancestral allele frequencies (B(1,1)); we ran analyses where the parameters of the beta distribution were inferred from the data (B(a,b)); last we ran analyses using the conditional likelihood model (CND)."
"The ancestral allele frequencies were drawn from a Beta(0.0188,0.0195) distribution, and 5,000 SNPs were simulated with n = 100 haploid individuals sampled in each population."
"[48] with the beta-with-spikes model is provided (BS); we further ran K IM T REE analyses assuming a beta distribution with fixed parameters for the ancestral allele frequencies (B(1,1)); we ran analyses where the parameters of the beta distribution were inferred from the data (B(a,b)); last we ran analyses using the conditional likelihood model (CND)."
"Asympto tic distributions of coalescenc e times and ancestral lineage number s for populations with temporal ly varying size."
"We examined the recombinant clone sequences to determine whether these replacements reverted the gene to its pre-LTEE ancestral state (i.e., the corresponding sequence in REL606, including the case in which that sequence is identical in REL606 and K-12) or, alternatively, introduced a different allele."
"In an hslU allele from Ara+1 and a pykF allele from Ara–4, recombination events reverted alleles with evolved mutations to their ancestral states, and the new mutations presumably arose later."
"The recombination event in nfrA reverted a W289  nonsense mutation to its ancestral state, but left unchanged a C144R substitution."
"Eleven of the 22 cases where an LTEE-evolved allele went back to its pre-LTEE ancestral state occurred in genes under strong positive selection in the LTEE [21, 27], indicating that many beneficial mutations were removed by Table 2."
"The new alleles that evolved after recombination had effectively reconstructed the ancestral states in hslU in Ara–1 and pykF in Ara–4 imply that these reversions of beneficial LTEE-derived mutations by recombination were not adaptive."
"If that were the case, then we would expect its ancestry to stem from just one of the four donor strains."
"In addition, and to our surprise, we found that one STLE population, designated Ara–3, had predominantly K-12 donor ancestry."
"The Ara–3 recombinant clones lack all of the LTEEderived mutations present in their ancestral recipient, but they still have small segments that Table 5."
"However, the two recipient strains with defects in their mismatch repair (Ara+3 and Ara–2) did not have more K-12 ancestry than the other recipients, even though previous research has shown that E."
"The most striking evidence that recombination could have maladaptive effects in the STLE was the finding that many beneficial mutations were effectively “erased” by replacement with donor alleles that were the same as the LTEE ancestral state, especially in populations Ara+1, Ara–3, and Ara–4."
"We used the breseq (version 0.31) pipeline [47] to analyze the genomes, with the ancestral LTEE strain REL606 as the reference genome unless otherwise specified."
"Histogram of the density of K-12 specific markers plotted along the genome coordinates of REL606, the ancestral strain of the LTEE."
"We adjusted the analysis for the following covariates: age, gender, smoking status, BMI category and 10 principal components of ancestry (PCs)."
"A substantial prehistoric European ancestry amongst Ashkenaz i maternal lineages ."
"These frequencies are correlated with the IARC reported incidence of ovarian cancer (Pearson’s r = 0.557 all HapMap populations) especially when excluding the Chinese American (CHD), African American (ASW) and Mexican ancestry (MEX) populations living in the United States (r = 0.858)."
"The sequenced women all self-report Caucasian ancestry which we confirmed through principal components analysis."
"Phenotypic variation in SynH tolerance is partly correlated with ancestral group We scored variation in lignocellulosic hydrolysate tolerance in several ways."
"Strains were grouped based on their ancestral population as indicated in the figure; Wine, Asian, NA (North American), WA (West African), and MOS (mosaic)."
"Local ancestry corrects for population structure in Saccharo myces cerevisiae genome-wi de association studies."
"We analyze empirical genetic, chromatin, and gene expression data from 65 African-ancestry and 47 European-a ncestry individuals and show that many of the paths prioritized by our method are consistent with the proposed causal model and often lie in likely functional regions."
"Finally, we analyze genotype, chromatin and expression data from 65 African-ancestry and 47 European-ances try individuals."
"All models were adjusted for age, sex, and the first ten principal componen ts of genetic ancestry."
"All models were adjusted for age, sex, and the first ten principal compone nts of genetic ancestry."
"A novel a-globin regulatory variant in African Americans modifies the effect of a3.7 kb CNV on red cell parameters In a recent meta-GWAS of red cell traits conducted in ~70,000 individuals of European or South Asian ancestry, a common single nucleotide variant (rs11248850, MAF = 0.50 in Europeans) was associated with MCH[19]."
"All models were adjusted for age, sex, and the first ten principal compone nts of genetic ancestry."
"In models adjusted for age, sex, and the first 10 principal components of genetic ancestry, we confirmed the previously reported association of the rs11248850 A allele with higher MCV, MCH, MCHC, and lower RBC count and RDW (Table 3)."
