"For these reasons, investigators have recently begun looking at signatures of very distant inbreeding (e.g., common ancestry up to ~100 generations ago) using genome-wide single nucleotide polymorphism (SNP) data in an attempt to understand whether autozygosity increases the risk to schizophrenia and other complex diseases[11]."
"A similar effect was detected for educational attainment: highly educated individuals were more likely to migrate and mate with highly educated and more diverse partners, making highly educated spouse pairs share less ancestry and leading to their offspring having lower Froh[29]."
"Controlling for ancestry principal components in this case would only help to the degree that degree of inbreeding/outbreeding is associated with ancestry."
"All FMD patients and controls were of European ancestry and have similar overall clinical features (Table 1)."
"All participants are of European ancestry and presented similar clinical characteristics (Table 1) and homogeneous diagnosis, exclusion and inclusion criteria."
"We applied quality control (QC) filters to the discovery cases and controls as recommended [35] (individual’s call rate < 97%, extreme heterozygosity, sex-discordant, duplicate or relatedness unsing PLINK (version 1.07).[36] Individuals with non-European ancestry were detected and excluded (54 cases and 9 controls) using the EIGENSTRAT program[37] and visualized by principal components analysis (PCA) including HapMap phase 3 samples."
"Cases and controls displayed a comparable distribution after ancestry QC (S1 Fig)."
"Data used is post quality control filtration for non-European ancestry origin and relatedness (TIFF) S2 Fig."
"In the 903 families, proband IQ was significantly associated with family ancestry (one-way ANOVA, P<4.8x10 -10 )."
"Associations of IQ with proband-private mtDNA mutations were computed in 638 probands of the major ethnic group among the 903 families who had a reported family ancestry of “white” or “more-than-one-race” and an mtDNA-haplogroup inferred maternal ancestry of “Europe”."
"We pruned the data set to contain 5,497 unrelated (nominal genetic relationship as calculated by GCTA < 0.05) individuals with European ancestry based on both self-reported ethnicity and principal component analysis."
"Quantifying the strength and causes of this selection against Neanderthal ancestry is key to understanding our relationship to Neanderthals and, more broadly, how populations remain distinct after secondary contact."
"We confirm that East Asians had somewhat higher initial levels of Neanderthal ancestry than Europeans even after accounting for selection."
"We find that the bulk of purifying selection against Neanderthal ancestry is best understood as acting on many weakly deleterious alleles."
"Thus, rather than being the result of hybrid incompatibilities, differences between human and Neanderthal effective population sizes appear to have played a key role in shaping our present-day shared ancestry."
"In particular, regions of high gene density or low recombination rate have low Neanderthal ancestry, which is consistent with selection removing Neanderthal ancestry more efficiently from these regions [13]."
"In addition, the X chromosome has lower levels of Neanderthal ancestry and Neanderthal ancestry is absent from the Y chromosome and mitochondria [2, 4, 5, 9, 13, 15, 16]."
"Finally, a pattern of lower levels of Denisovan ancestry near genes and on the X chromosome in modern humans have also recently been reported [18, 19]."
"However, we can recognize alleles of Neanderthal ancestry in humans by aggregating information along the genome using statistical methods [9, 13]."
"We fit these predictions to recently published estimates of the frequency of Neanderthal ancestry in modern humans [13]."
"In Figs 2 and 3, we show the RSS surfaces for the parameters p 0 , s, and µ for autosomal variation in Neanderthal ancestry in the EUR and ASN populations."
"We obtain similar estimates if we assume that the Neanderthal ancestry in humans has reached its equilibrium frequency or if we account for the effect of multiple selected sites (see S2 Text)."
"We finally turn to the X chromosome, where observed levels of Neanderthal ancestry are strongly reduced compared to autosomes [9, 13]."
"Here, we have shown that observed patterns of Neanderthal ancestry in modern human populations are consistent with genome-wide purifying selection against many weakly deleterious alleles."
"We argue that the bulk of selection against Neanderthal ancestry in humans may be best understood as being due to the accumulation of alleles that were effectively neutral in the Neanderthal population, which was of relatively small effective size."
"This is not to say that alleles of larger effect, in particular those underlying ecological or behavioral differences, did not exist, but rather that they are not needed to explain the observed relationship between gene density and Neanderthal ancestry."
"Alleles of large negative effect would have quickly been removed from admixed populations, and would likely have led to extended genomic regions showing a deficit of Neanderthal ancestry as described by [9, 13, 47]."
"Since our method allows us to model the expected amount of Neanderthal ancestry along the genome accounting for selection, it could serve as a better null model for finding regions that are unusually devoid of Neanderthal ancestry."
"The reduction in neutral Neanderthal ancestry due to unlinked sites under selection is felt equally along the genome and as such, our estimate of p 0 is an effective admixture proportion that incorporates the genomewide effect of unlinked deleterious mutations, but not the localized effect of linked deleterious mutations (as formalized by Bengtsson [23])."
"This is likely because much of the information about s and µ comes from the localized dip in Neanderthal ancestry close to genes, and thus these estimates are not strongly affected by the inclusion of other weakly linked deleterious alleles (the effects of which are more uniform, and mostly affect p 0 )."
"Our simulations include both ancestral variation and new mutations, but the majority of the segregating alleles at the end of the simulations represent differentially sorted ancestral polymorphisms."
"Higher levels of neandert hal ancestry in East Asians than in Europeans ."
"Selection and reduced population size cannot explain higher amoun ts of Neandertal ancestry in East Asian than in European human populat ions."
"Neandertha l ancestry drives evolution of lipid catabolis m in contempo rary Europeans ."
"The genomi c landscape of Neanderth al ancestry in present-day humans."
"The Combined Landscape of Denisova n and Neanderthal Ancestry in PresentDay Humans ."
"This heterogeneity can naturally contribute to non-replication of genetic effects in different populations even in case of populations of the same ancestry and phenotypes [16–18]."
"Such difficulties clearly emerge when different cohorts and datasets are put together, including subjects of different ancestry [6], in order to increase statistical power."
"We obtained whole blood RNA-seq and genome-wide genotype data for 922 individuals from the Depression Genes and Networks (DGN) cohort [26], all of European ancestry."
"We gathered the largest feasible dataset to do so, however the strength of our conclusions are limited by the sample size we achieved and diverse study designs of component datasets, including mixed ancestry and ethnicity."
"On the other hand, our use of diverse-ancestry datasets may render our results applicable to a broader group of populations."
"Despite our limited power to detect modest relative differences, we do observe an extremely clear case-pseudocontrol difference, demonstrating our power to detect large differences even in a mixed-ancestry dataset."
"For this dataset, quality control measures were applied within technical batches (Table 2), stratified by ancestry."
"Unrelated case-control datasets were excluded from these analyses, as they would be challenging to match precisely by genetic ancestry."
"ATM expression level was determined using microarray and only included patients of European ancestry."
"To make simulations realistic in terms of the distribution of minor allele frequencies (MAF) and LD, we simulated quantitative traits with specific genetic architecture by conditioning on the genotypes of a lung cancer GWAS [27], which had 11,924 samples of European ancestry and 485,315 autosomal SNPs after quality control."
"Three cancer GWAS with individual genotype data We analyzed three cancer GWAS with individual level genotype data: the bladder cancer [36, 37] GWAS of European ancestry including 5,937 cases and 10,862 controls, the pancreatic cancer GWAS [38] of European ancestry (after excluding samples with Asian or African ancestry) including 5,066 cases and 8,807 controls, and the Asian non-smoking female lung cancer GWAS [39] with 5,510 cases and 4,544 controls."
"We also downloaded the GERA (Genetic Epidemiology Research on Adult Health and Aging) GWAS data of European ancestry with 7,131 T2D patients and 49,747 samples without T2D (but may have other medical conditions, e.g., 27.4% with cancers, 25.4% with asthma, 25.4% with allergic rhinitis and 12.4% with depression)."
"Summary statistics were obtained by meta-analyzing all PGC2 schizophrenia GWAS except the MGS [42] (Molecular Genetics of Schizophrenia) subjects of European ancestry."
"The summary statistics for prostate cancer were obtained from the PRACTICAL (PRostate cancer AssoCiation group To Investigate Cancer Associated aLterations) consortium and The GAME-ON/ELLIPSE (Elucidating Loci Involved in Prostate Cancer Susceptibility) Consortium with samples from populations of European, African, Japanese and Latino ancestry [5]."
"Here, LD was calculated based on the genotype data of relevant ancestry in The 1000 Genomes Project [29]."
"In addition, eSNPs and meSNPs derived in lung tissues were enriched in lung cancer GWAS of both European and Asian ancestry."
"To characterize and quantify patterns of admixture across the genome, a number of methods have been developed for local ancestry inference."
"First, all local ancestry inference methods require some prior assumption about the expected ancestry tract lengths."
"To address these issues, we introduce a novel hidden Markov model for estimating local ancestry that models the read pileup data, rather than genotypes, is generalize d to arbitrary ploidy, and can estimate the time since admixture during local ancestry inference."
"We demonstrate that our method can simultaneously estimate the time since admixture and local ancestry with good accuracy, and that it performs well on samples of high ploidy—i.e."
"As this method is very general, we expect it will be useful for local ancestry inference in a wider variety of population s than what previously has been possible."
"We then applied our method to pooled sequencing data derived from populations of Drosophila melanogaster on an ancestry cline on the east coast of North America."
"We find that regions of local recombination rates are negatively correlated with the proportion of African ancestry, suggesting that selection against foreign ancestry is the least efficient in low recombination regions."
"Our results illustrate the potential of local ancestry inference for elucidating fundamental evolutionary processes."
"Although the average ancestry proportion in each descendant is equal to the proportion of ancestors from each of the ancestral populations, the contribution of each ancestry type is variable across the genome."
"Furthermore, our method simultaneously estimates local ancestry and the number of generations since admixture— the time that the two ancestral populations first encountered each other."
"Finally, in applying our method to data from an admixture zone between ancestral populations of Drosophila melanogaster, we find many lines of evidence consistent with natural selection operating to against the introduction of foreign ancestry into populations of one predominant ancestry type."
"Individuals’ ancestry can affect disease susceptibility in admixed populations, and inferring and correcting for sample population ancestries is a common practice in human genome wide association studies [8–10]."
"Estimating genome-wide ancestry proportions has become a common practice in population genetic inference."
"More recently, this model for ancestry proportion estimation has been extended to cases where individual genotypes are not known, but can be studied probabilistically using low-coverage sequencing short read sequencing data [20], which is an important step towards accommodating modern sequencing practices."
"[21] developed a method for estimating ancestry proportions in pooled population samples of relatively high ploidy (i.e."
"In general, it is straightforward to estimate genome-wide ancestry proportions using a number of sequencing strategies and applications."
"It is substantially more challenging to accurately estimate local ancestry (LA) at markers distributed along the genome of a sample."
"Nonetheless, analyses of LA have the potential to yield more nuanced insights into our understanding of the evolutionary processes affecting ancestry proportions across the genome."
"[22] suggested that a hidden Markov model (HMM) is a straightforward means of inferring the ancestry states at each site in the genome (which are unobserved) based on observed genotype data distributed along a chromosome."
"A number of approaches exist to estimate the time since admixture based on well characterized ancestry tract length distributions [26–29] but in general, these parameters are unknown prior to LAI."
"Briefly, as with many previously proposed LAI methods, we model ancestry across the genome of a sample as a HMM."
"Finally, we apply this method to a Drosophila melanogaster ancestry cline on the east coast of North America."
"This species originated in sub-Saharan Africa, and approximately 10,000– 15,000 years ago a subpopulation expanded out of the ancestral range."
"During this expansion, the derived subpopulation experienced a population bottleneck that resulted in decreased nucleotide polymorphism, extended linkage disequilibrium within the derived population and substantial genetic differentiation between ancestral and derived populations [2,35–39]."
"Hereafter, the ancestral population will be referred to as “African” and the derived population as “Cosmopolitan”."
"Where these populations encountered each other in eastern North America, they form an ancestry cline where southern populations have a greater contribution of African ancestry than northern populations [21]."
"Previous work on these ancestry clines has shown that ancestry proportions vary across populations with increasing proportions of cosmopolitan alleles in more temperate localities."
"Furthermore, strong epistatic reproductive isolation barriers partially isolate individuals from northern and southern populations along this ancestry cline [46,47]."
"This may be generally consistent with recent observations of ancestry-associated epistatic fitness interactions within a D."
"Here, we show that African ancestry in North American D."
"Furthermore, we identify numerous loci with decreased African ancestry across all populations, which suggests that these alleles that are disfavored on predominantly cosmopolitan genetic backgrounds."
"In the model, we assumed that the focal population was founded following a single discrete admixture event between two ancestral subpopulations, labeled 0 and 1, with admixture proportions 1-m and m, respectively, at a time t generations in the past."
"Importantly, we designed this method to simultaneously estimate the time of admixture, which is related to the correlation between ancestry informative markers along a chromosome."
"For this model, it is assumed that the number of chromosomes present in a sample, n, is known and that the global ancestry proportion, m, is known."
"Briefly, we first simulated genetic diversity consistent with ancestral populations using a coalescent simulation method [55]."
"We then generated ancestry tracts consistent with admixture models developed to test our inference method using the forward-time admixture simulation program, SELAM [56]."
"We then took the remaining chromosomes and placed them on the appropriate ancestry tracts in admixed chromosomes."
"Implicitly, this procedure assumes that the allele frequencies in the reference panel and the admixed individuals whose ancestry is from a given reference panels are equivalent."
"Nonetheless, below we assess the impact of differences in the ancestral allele frequencies for plausible demographic models in this species."
"Dependence on Ancestral Linkage Disequilibrium Within an admixed population, there are two sources of LD."
"LD that is induced due to the correlation of alleles from the same ancestry type (i.e."
"The second type, ancestral LD, limits the independence of the ancestral information captured by each marker, and is expected to confound HMM-based analyses, particularly as we aimed to estimate the time since admixture within this framework."
"We therefore sought to quantify the effect of ancestral LD by discarding one of each pair of sites in LD within either ancestral population."
"We found that ancestral LD tends to increase admixture time estimates obtained using our method, and we decreased the cutoff of the LD parameter, |r|, by 0.1 until the time estimates obtained for single chromosomes were unbiased with respect to the true time since admixture."
"We found that |r|  0.4 fit this criterion, although for relatively ancient admixture events with highly skewed ancestry proportions—i.e."
"This reflects the fact that the SMC’ ancestry tract distribution performs poorly with highly skewed ancestry proportions and especially for long times since admixture [57]."
"For example when m = 0.1, there was a much larger effect of ancestral LD than when m = 0.9."
"This is due to differences in the variability of LD within the ancestral populations."
"Because the time estimation procedure appears to be sensitive to the amount of ancestral LD present in the data, simulations of the type we described here may be necessary to determine what |r| cutoffs are required to produce unbiased time estimates given the ancestral LD of the populations in a given analysis using this method."
"The effect of increasing stringency with ancestra l LD pruning."
"From left to right, ancestry proportion s are 0.1, 0.25, 0.5, 0.75 and 0.9."
"From left to right, ancestry proportion s are 0.1, 0.25, 0.5, 0.75 and 0.9."
"We emphasize that this challenge is not unique to this application, but will impact virtually all ancestry estimation methods that rely on a genetic map for estimating the time since admixture."
"Non-Independence Among Ancestry Tracts As described above, estimates of the time of admixture demonstrate an apparent bias in pools of higher ploidy (Fig 2)."
"This is particularly apparent at highly skewed ancestry proportions."
"Given that this bias is primarily evident in pools of 10 to 20 individuals, we hypothesized that it might be due to the non-independence of ancestry tracts among chromosomes, which should tend to disproportionately affect samples of higher ploidy because all ancestry breakpoints are assumed to be independent in our model."
"This result reflects the fact that smaller populations will tend to coalesce at a portion of the loci in the genome relatively quickly, and ancestry tracts cannot become smaller following coalescence."
"Furthermore, in some cases it should be straightforward to determine if a population has coalesced to either ancestry state at a large portion of the loci in the genome, potentially obviating this issue."
"Hence, the rate of transition between ancestry types is actually slightly higher in larger populations where back coalescence is less likely than we assumed during the LAI procedure."
"Whereas, when panel sizes were just 10 chromosomes, time estimates were clearly biased and the result was variable across ancestry proportions (S4 Fig)."
"Allele Frequency Differences Between Ancestral and Admixed Populations Ultimately, there are three reasons why allele frequencies in the reference panels and in the admixed population panel would be expected to differ beyond that expected from binomial samples with the same mean."
"First, some amount of genetic drift may have occurred in the ancestral population and in the admixed population in the time since the admixed population was founded."
"Second, in some cases, it is infeasible to sample the ancestral population of an admixed group, and a genetically divergent population must suffice as the reference panel if this method is to be used."
"Third, divergent selection may quickly modify allele frequencies between admixed and ancestral populations."
"Although time estimates obtained using this approach are weakly positively biased with increasing divergence between the ancestral population and reference panels, the accuracy of this LAI method is largely unaffected (S5 Fig)."
"Nonetheless, in applications to other populations, with potentially differently structured ancestral populations, it would be necessary to examine the effects of this bias in detail."
"Specifically, we simulated data with a mean sequencing depth of 25, a time since admixture of 1500 generations, and an ancestry proportion of 0.8."
"Although the posterior credible interval was again too narrow, the mean posterior error was just 0.053 when expressed as an ancestry frequency, indicating that this approach can produce LA estimates that are close to their true values for existing sequencing datasets (e.g."
"Relative to a single pulse admixture model, this indicates that the ancestry tract lengths will tend to be longer than those under a single pulse admixture model in which all individuals entered at time t."
"In the second set of simulations, we considered additive selection on alleles that are perfectly correlated with local ancestry in a given region (i.e."
"Ancestry tracts tend to be longer immediately surrounding selected sites, and we therefore expected admixture time to be underestimated when selection is widespread."
"However, with more widespread selection on alleles associated with local ancestry, time estimates showed a downward bias that increased with increasing numbers of selected loci."
"This is likely because selected loci will tend to be associated with longer ancestry tracts due to hitchhiking."
"WinPop was originally designed for local ancestry inference in very recently admixed populations."
"The 95% credible interval (shaded blue region), and the posterior mean (red) contrasted with the true ancestry frequencies (black)."
"Simulate d data were generated with an admixture time of 1500 generation s, an ancestry proportion of 0.2, a sample ploidy of 100, and a mean sequencin g depth of 25."
"We therefore reran WinPop, but instead of pruning LD within the admixed population, we removed sites in strong LD within the ancestral populations as described above in our method."
"At longer times since admixture a given genomic window may overlap a breakpoint between ancestry tracts."
"However WinPop supports LAI with multiple ancestral populations, which Table 1."
"Assessing Applications to Human Populations Given the strong interest in studying admixture and local ancestry in human populations (e.g."
"In other words, the scales of ancestral LD and admixture LD become similar rapidly in admixed human populations."
"For a relatively short time since admixture, around 100 generations, it is possible to obtain accurate and approximately unbiased estimates of the admixture time over a wide range of ancestry proportions, indicating that this method may be applicable to recently admixed human populations as well (Fig 4)."
"However, these results also indicate that our method may not be robust in situations where the background LD is high and ancestry informative markers are neither common nor distributed evenly across the genome."
"There are likely two causes for differences observed in the mean ancestry posterior among individuals."
"Second, the ancestral LD in the Inuit population is extensive [61], and we could only retain a relatively small proportion of the markers after LD pruning in the reference panels."
"In(3R)Mo is an exception to this general pattern of elevated African ancestry within inverted arrangements (Fig 5)."
"Consistent with these observations, In(3R)Mo displayed lower overall African ancestry than chromosome arm 3R than standard arrangement chromosomes."
"Although chromosomal inversions may affect patterns of LA in the genome on this ancestry cline, we believed including chromosomal inversions in the pool-seq datasets would not heavily bias our analysis of LA clines."
"Furthermore, inversion breakpoint regions were not enriched for LA cline outliers in our analysis (S2 Table), suggesting that inversions have a limited impact on overall patterns of local ancestry on this cline."
"Genomic variation across two ancestry clines have been studied previously [21,38,40,52]."
"In particular, the cline on the east coast of North America has been sampled densely by sequencing large pools of individuals to estimate allele frequencies, and previous work has shown that the overall proportion of African ancestry is strongly correlated with latitude [21]."
